{
  "kicker": "가지당 리프 상한 상한 표본함",
  "title": "두 가지에 리프 넷씩 세로 상한 상한 표본 문장",
  "nodes": [
    {
      "id": "r",
      "label": "루트라벨열넷 상한 표본 문",
      "level": 0
    },
    {
      "id": "b0",
      "label": "1번 중간 노드 라벨 상한 표본함",
      "note": "부연 열세 자 상한 표본",
      "level": 1
    },
    {
      "id": "l00",
      "label": "1-1 리프 라벨 상한 상한 표본 문장으",
      "level": 2
    },
    {
      "id": "l01",
      "label": "1-2 리프 라벨 상한 상한 표본 문장으",
      "level": 2
    },
    {
      "id": "l02",
      "label": "1-3 리프 라벨 상한 상한 표본 문장으",
      "level": 2
    },
    {
      "id": "l03",
      "label": "1-4 리프 라벨 상한 상한 표본 문장으",
      "level": 2
    },
    {
      "id": "b1",
      "label": "2번 중간 노드 라벨 상한 표본함",
      "note": "부연 열세 자 상한 표본",
      "level": 1
    },
    {
      "id": "l10",
      "label": "2-1 리프 라벨 상한 상한 표본 문장으",
      "level": 2
    },
    {
      "id": "l11",
      "label": "2-2 리프 라벨 상한 상한 표본 문장으",
      "level": 2
    },
    {
      "id": "l12",
      "label": "2-3 리프 라벨 상한 상한 표본 문장으",
      "level": 2
    },
    {
      "id": "l13",
      "label": "2-4 리프 라벨 상한 상한 표본 문장으",
      "level": 2
    }
  ],
  "edges": [
    {
      "from": "r",
      "to": "b0"
    },
    {
      "from": "b0",
      "to": "l00"
    },
    {
      "from": "b0",
      "to": "l01"
    },
    {
      "from": "b0",
      "to": "l02"
    },
    {
      "from": "b0",
      "to": "l03"
    },
    {
      "from": "r",
      "to": "b1"
    },
    {
      "from": "b1",
      "to": "l10"
    },
    {
      "from": "b1",
      "to": "l11"
    },
    {
      "from": "b1",
      "to": "l12"
    },
    {
      "from": "b1",
      "to": "l13"
    }
  ],
  "frame": {
    "brand": "ReportArchive 표본 상한 표본 문",
    "idx": "98",
    "total": "99"
  }
}
