{
  "kicker": "계층 상한 킥커 상한 표본 문",
  "title": "네 가지와 여덟 리프 상한 확인 상한 표본 문장",
  "nodes": [
    {
      "id": "r",
      "label": "루트라벨열넷 상한 표본 문",
      "level": 0
    },
    {
      "id": "b0",
      "label": "1번 중간 노드 라벨 상한 표본함",
      "note": "부연 열세 자 상한 표본",
      "level": 1
    },
    {
      "id": "l00",
      "label": "1-1 리프 라벨 상한 상한 표본 문장으",
      "level": 2
    },
    {
      "id": "l01",
      "label": "1-2 리프 라벨 상한 상한 표본 문장으",
      "level": 2
    },
    {
      "id": "b1",
      "label": "2번 중간 노드 라벨 상한 표본함",
      "note": "부연 열세 자 상한 표본",
      "level": 1
    },
    {
      "id": "l10",
      "label": "2-1 리프 라벨 상한 상한 표본 문장으",
      "level": 2
    },
    {
      "id": "l11",
      "label": "2-2 리프 라벨 상한 상한 표본 문장으",
      "level": 2
    },
    {
      "id": "b2",
      "label": "3번 중간 노드 라벨 상한 표본함",
      "note": "부연 열세 자 상한 표본",
      "level": 1
    },
    {
      "id": "l20",
      "label": "3-1 리프 라벨 상한 상한 표본 문장으",
      "level": 2
    },
    {
      "id": "l21",
      "label": "3-2 리프 라벨 상한 상한 표본 문장으",
      "level": 2
    },
    {
      "id": "b3",
      "label": "4번 중간 노드 라벨 상한 표본함",
      "note": "부연 열세 자 상한 표본",
      "level": 1
    },
    {
      "id": "l30",
      "label": "4-1 리프 라벨 상한 상한 표본 문장으",
      "level": 2
    },
    {
      "id": "l31",
      "label": "4-2 리프 라벨 상한 상한 표본 문장으",
      "level": 2
    }
  ],
  "edges": [
    {
      "from": "r",
      "to": "b0"
    },
    {
      "from": "b0",
      "to": "l00"
    },
    {
      "from": "b0",
      "to": "l01"
    },
    {
      "from": "r",
      "to": "b1"
    },
    {
      "from": "b1",
      "to": "l10"
    },
    {
      "from": "b1",
      "to": "l11"
    },
    {
      "from": "r",
      "to": "b2"
    },
    {
      "from": "b2",
      "to": "l20"
    },
    {
      "from": "b2",
      "to": "l21"
    },
    {
      "from": "r",
      "to": "b3"
    },
    {
      "from": "b3",
      "to": "l30"
    },
    {
      "from": "b3",
      "to": "l31"
    }
  ],
  "omitted": 27,
  "frame": {
    "brand": "ReportArchive 표본 상한 표본 문",
    "idx": "99",
    "total": "99"
  }
}
